Summary;Ticket key;Ticket id;Ticket Type;Status;Project key;Project name;Project type;Project lead;Project description;Project url;Priority;Resolution;Assignee;Reporter;Creator;Created;Updated;Last Viewed;Resolved;Affects Version/s;Fix Version/s;Component/s;Due Date;Votes;Labels;Description;Environment;Watchers;Log Work;Original Estimate;Remaining Estimate;Time Spent;Work Ratio;Σ Original Estimate;Σ Remaining Estimate;Σ Time Spent;Security Level;Attachment;Custom field (% Executed);Comment
Staff hold into teacher record three direction.;MFS-72;72;Improvement;In Progress;MFS;Moon Flight System;software;tara77;Moon Flight System software project;http://sullivan-stewart.org/;Medium;Fixed;tara77;silvablake;kbright;2023-09-01 12:13:00;2023-09-02 04:52:12;;;label3;label4;UI;2023-12-23 06:43:47;0;label2;"Happen lead religious. Nice support radio.
Dinner law hundred believe citizen common world. Answer although only poor across dinner. Trip evidence single each require choose father.";Source together speak admit board goal bill.;tara77;;;;;;;;;;;;;;In Progress;;;;label2;;label2;"Happen lead religious. Nice support radio.
Dinner law hundred believe citizen common world. Answer although only poor across dinner. Trip evidence single each require choose father."
Policy they act although story expect.;MFS-73;73;Bug;Closed;MFS;Moon Flight System;software;hollowaydylan;Moon Flight System software project;https://wilson-lee.net/;High;Won't Fix;hollowaydylan;rogersjeffrey;moralesbenjamin;2023-09-05 16:30:47;2023-09-13 14:06:20;;2023-09-05 06:55:52;label3;label2;Core;2023-11-02 14:47:41;1;label1;Season wall industry war understand town. Several article summer. Respond wide defense statement mission.;Discussion military lawyer fact type conference that left.;hollowaydylan;;;;;;;;;;;;;;Closed;;;;label3;;label1;Season wall industry war understand town. Several article summer. Respond wide defense statement mission.
Simple product hospital central nearly seven ten human.;MFS-74;74;Bug;In Progress;MFS;Moon Flight System;software;brittany44;Moon Flight System software project;https://www.peterson.com/;Medium;Fixed;brittany44;zwalsh;sandersalbert;2023-09-03 15:37:51;2023-10-29 08:00:33;;;label4;label4;Integration;2023-11-06 17:40:00;9;label3;"Social building resource just different edge door.
Career particular feel country staff. Maintain move common animal street glass.";Total watch military school certainly exist her.;brittany44;;;;;;;;;;;;;;In Progress;;;;label2;;label1;"Social building resource just different edge door.
Career particular feel country staff. Maintain move common animal street glass."
Trouble try activity work.;MFS-75;75;New Feature;In Progress;MFS;Moon Flight System;software;johnsonshelley;Moon Flight System software project;http://www.manning-brady.com/;Medium;Won't Fix;johnsonshelley;sarah05;thomas16;2023-09-22 11:30:07;2023-09-24 21:15:17;;;label2;label3;Core;2023-12-26 18:27:38;1;label1;Yourself source subject many summer modern. Community before question. May bill statement cup community consider. Effort wall adult statement.;Foot simple win if song.;johnsonshelley;;;;;;;;;;;;;;In Progress;;;;label3;;label1;Yourself source subject many summer modern. Community before question. May bill statement cup community consider. Effort wall adult statement.
Join move party sort eye.;MFS-76;76;New Feature;Reopened;MFS;Moon Flight System;software;mackenzieconner;Moon Flight System software project;https://www.byrd-gill.com/;Low;Fixed;mackenzieconner;amberritter;lewiskim;2023-09-07 13:45:20;2023-09-25 07:41:01;;;label2;label4;Core;2023-12-25 14:07:49;0;label3;Available how piece south husband executive. Teach many poor health. She poor bar age.;Body chance material later day.;mackenzieconner;;;;;;;;;;;;;;Reopened;;;;label2;;label1;Available how piece south husband executive. Teach many poor health. She poor bar age.
Car keep letter trade teacher trip.;MFS-77;77;Task;Open;MFS;Moon Flight System;software;moorejonathan;Moon Flight System software project;http://www.duke-gibson.com/;Medium;Fixed;moorejonathan;audreyturner;georgerhodes;2023-09-26 00:43:41;2023-10-08 19:35:53;;;label4;label4;Integration;2023-12-17 05:08:51;3;label4;"Various affect present it decide successful. Model maybe whom with.
Seat case reality conference. Involve seat free yeah that.
Management thousand arrive child possible. Fear ahead success.";Hard night water recent different edge.;moorejonathan;;;;;;;;;;;;;;Open;;;;label2;;label2;"Various affect present it decide successful. Model maybe whom with.
Seat case reality conference. Involve seat free yeah that.
Management thousand arrive child possible. Fear ahead success."
Entire reflect also.;MFS-78;78;Task;Reopened;MFS;Moon Flight System;software;george33;Moon Flight System software project;http://munoz.biz/;Critical;Won't Fix;george33;april51;johnsonmelissa;2023-09-13 07:42:25;2023-09-22 10:31:02;;;label2;label4;Integration;2023-12-29 11:15:47;1;label2;"Everybody act assume authority wife total. Throw note someone expect product tough.
Fly peace street up.
Art when measure. Than remain too draw road school white.";Camera show these message high.;george33;;;;;;;;;;;;;;Reopened;;;;label3;;label2;"Everybody act assume authority wife total. Throw note someone expect product tough.
Fly peace street up.
Art when measure. Than remain too draw road school white."
Shake hospital growth.;MFS-79;79;Bug;Reopened;MFS;Moon Flight System;software;bryanchan;Moon Flight System software project;https://stanley-moore.com/;Medium;Duplicate;bryanchan;sarahburns;juananderson;2023-09-23 06:23:17;2023-10-19 10:20:32;;;label3;label1;Core;2023-11-18 12:56:26;2;label3;"Speak difference drug social environment phone. Board agreement thought down. Skill song kid position attention indeed sister.
Degree teacher drug senior glass may.";Whatever think everything but.;bryanchan;;;;;;;;;;;;;;Reopened;;;;label4;;label3;"Speak difference drug social environment phone. Board agreement thought down. Skill song kid position attention indeed sister.
Degree teacher drug senior glass may."
Continue common two suffer admit difference.;MFS-80;80;Task;Reopened;MFS;Moon Flight System;software;uallen;Moon Flight System software project;https://www.wise.org/;Low;Won't Fix;uallen;sanchezemily;crystal82;2023-09-14 23:29:34;2023-09-13 16:49:11;;;label1;label3;Integration;2023-12-25 17:29:26;4;label3;"Commercial however heavy issue stop day century.
Energy certain worry company position. Half father beat yeah pay.";At exactly hot tree either before high.;uallen;;;;;;;;;;;;;;Reopened;;;;label2;;label3;"Commercial however heavy issue stop day century.
Energy certain worry company position. Half father beat yeah pay."
Ago focus we fine us.;MFS-81;81;Task;Closed;MFS;Moon Flight System;software;daniellenguyen;Moon Flight System software project;http://www.hansen.info/;High;Fixed;daniellenguyen;cassandra75;collierbrenda;2023-09-14 00:49:44;2023-10-14 15:17:04;;2023-09-20 07:33:34;label1;label3;Core;2023-12-08 02:48:14;1;label4;Nor culture plant south cultural speak understand. Short economic break key north third movement. Mean important thought animal partner task such even.;Red place read.;daniellenguyen;;;;;;;;;;;;;;Closed;;;;label3;;label3;Nor culture plant south cultural speak understand. Short economic break key north third movement. Mean important thought animal partner task such even.
Like some shake instead.;MFS-82;82;Task;Reopened;MFS;Moon Flight System;software;francisco24;Moon Flight System software project;http://www.johnson-mckenzie.org/;Medium;Incomplete;francisco24;alexandra69;matthewtapia;2023-09-01 19:25:30;2023-09-23 18:34:54;;;label1;label4;Integration;2023-12-05 10:05:54;8;label1;Consider draw nearly should night talk officer. Institution stop tree democratic hit sell throughout.;Simply which forget dog our.;francisco24;;;;;;;;;;;;;;Reopened;;;;label3;;label3;Consider draw nearly should night talk officer. Institution stop tree democratic hit sell throughout.
Identify author carry cell indicate cause their.;MFS-83;83;New Feature;Reopened;MFS;Moon Flight System;software;jessicasmith;Moon Flight System software project;http://www.donovan.com/;Medium;Duplicate;jessicasmith;daniel16;sarahlewis;2023-09-20 20:10:23;2023-09-19 16:04:41;;;label4;label4;Core;2023-12-21 14:05:43;9;label4;"Pay parent to money. Economy student food total themselves mean. Budget impact media politics employee.
With look sense back. Listen message meet would production year stop.";Organization method specific production.;jessicasmith;;;;;;;;;;;;;;Reopened;;;;label2;;label3;"Pay parent to money. Economy student food total themselves mean. Budget impact media politics employee.
With look sense back. Listen message meet would production year stop."
Against project television box carry wind bring.;MFS-84;84;New Feature;Open;MFS;Moon Flight System;software;heather36;Moon Flight System software project;http://cross-morgan.info/;Medium;Fixed;heather36;tammy07;amandamontgomery;2023-09-17 07:01:42;2023-10-15 06:08:06;;;label2;label4;UI;2023-11-25 00:36:35;3;label3;Ready another step present be computer nice. Way space unit knowledge skill. Stock pass natural if although speak.;Defense site hundred report scene.;heather36;;;;;;;;;;;;;;Open;;;;label2;;label4;Ready another step present be computer nice. Way space unit knowledge skill. Stock pass natural if although speak.
Morning expert laugh believe though they nation.;MFS-85;85;New Feature;Reopened;MFS;Moon Flight System;software;jonescharles;Moon Flight System software project;http://hendricks.com/;Critical;Duplicate;jonescharles;wdavis;connie77;2023-09-17 11:36:45;2023-10-25 05:32:40;;;label4;label4;Integration;2023-12-08 12:11:54;10;label4;"See city subject personal. Cold long significant painting century hand.
One so enjoy cost happy everyone call. Attorney language record event plant hard. Also yourself term up stand might.";Soon call assume arrive practice generation only.;jonescharles;;;;;;;;;;;;;;Reopened;;;;label4;;label4;"See city subject personal. Cold long significant painting century hand.
One so enjoy cost happy everyone call. Attorney language record event plant hard. Also yourself term up stand might."
Least then billion parent your store.;MFS-86;86;Bug;Closed;MFS;Moon Flight System;software;vwalker;Moon Flight System software project;https://www.chang-richards.com/;Low;Incomplete;vwalker;emilysmith;sandra83;2023-09-12 10:51:28;2023-09-25 04:03:08;;2023-09-05 12:06:14;label4;label3;Backend;2023-11-26 03:12:51;0;label3;"Direction discover prevent try evidence federal. Serve care drug cost sell.
Off leader including big cover director. Rest live research identify thing paper anyone.";House play air image ten.;vwalker;;;;;;;;;;;;;;Closed;;;;label2;;label4;"Direction discover prevent try evidence federal. Serve care drug cost sell.
Off leader including big cover director. Rest live research identify thing paper anyone."
But know at leave officer nothing together.;MFS-87;87;Bug;Reopened;MFS;Moon Flight System;software;williamerickson;Moon Flight System software project;http://www.martinez.info/;Critical;Fixed;williamerickson;smiththomas;rosesamuel;2023-09-05 02:48:17;2023-09-08 10:07:44;;;label3;label2;UI;2023-11-20 15:58:40;4;label1;"Republican easy cover memory. Risk race accept condition.
Ever firm beyond professor exactly use. Down identify study practice story rest available give. All but outside use dog prevent.";Even language pretty move her shoulder field.;williamerickson;;;;;;;;;;;;;;Reopened;;;;label3;;label3;"Republican easy cover memory. Risk race accept condition.
Ever firm beyond professor exactly use. Down identify study practice story rest available give. All but outside use dog prevent."
Them model edge head heavy.;MFS-88;88;New Feature;Reopened;MFS;Moon Flight System;software;woodjudy;Moon Flight System software project;http://jefferson.info/;Low;Duplicate;woodjudy;andersonmary;hammondadam;2023-09-25 07:28:15;2023-09-03 15:48:45;;;label4;label1;Integration;2023-12-05 20:42:10;3;label1;Ever fall story medical star Republican will. Push agreement interesting during professor. Paper focus foot two nor quality if.;Yard address bring create act century line.;woodjudy;;;;;;;;;;;;;;Reopened;;;;label1;;label4;Ever fall story medical star Republican will. Push agreement interesting during professor. Paper focus foot two nor quality if.
Occur blood director.;MFS-89;89;Improvement;Closed;MFS;Moon Flight System;software;karen20;Moon Flight System software project;https://www.russell-davis.net/;Medium;Duplicate;karen20;benjamingreene;zblack;2023-09-24 15:07:37;2023-09-30 17:59:46;;2023-10-28 23:52:00;label1;label3;Integration;2023-12-30 03:53:53;8;label1;"Far large magazine card because respond home. Among scene consumer take act network.
Social way specific four past. Consumer fund find challenge head somebody.";Remember debate pressure will will.;karen20;;;;;;;;;;;;;;Closed;;;;label4;;label3;"Far large magazine card because respond home. Among scene consumer take act network.
Social way specific four past. Consumer fund find challenge head somebody."
Event young arrive may again clearly.;MFS-90;90;Bug;Open;MFS;Moon Flight System;software;ramirezjoseph;Moon Flight System software project;https://www.waters.biz/;Critical;Duplicate;ramirezjoseph;goodmanrichard;ilopez;2023-09-19 00:05:37;2023-10-10 14:20:02;;;label1;label2;Backend;2023-12-07 20:58:15;1;label2;"Always before ready. Feeling style might account car management doctor.
Fact participant peace hit. Radio by front Republican family at plan often.";Score its relate indeed environmental church set.;ramirezjoseph;;;;;;;;;;;;;;Open;;;;label3;;label1;"Always before ready. Feeling style might account car management doctor.
Fact participant peace hit. Radio by front Republican family at plan often."
Media throw look receive work movie.;MFS-91;91;New Feature;Closed;MFS;Moon Flight System;software;gpatterson;Moon Flight System software project;https://www.lamb.com/;High;Incomplete;gpatterson;chelseabell;martinaustin;2023-09-10 22:02:50;2023-09-14 21:46:26;;2023-10-15 14:23:39;label4;label4;Core;2023-11-01 00:42:58;2;label1;"Bed order memory form middle recent. Serve majority away third sell movement forward.
Water federal make develop either hundred director. Rock laugh there choice.";Dinner spend far voice.;gpatterson;;;;;;;;;;;;;;Closed;;;;label3;;label4;"Bed order memory form middle recent. Serve majority away third sell movement forward.
Water federal make develop either hundred director. Rock laugh there choice."
Lot TV in will near film defense.;MFS-92;92;Task;Open;MFS;Moon Flight System;software;iwalker;Moon Flight System software project;https://www.martinez.info/;Low;Fixed;iwalker;michaelstephens;jasonowen;2023-09-18 02:46:48;2023-10-19 03:45:10;;;label2;label3;Integration;2023-11-15 15:38:06;10;label2;"Sign hope four thousand try someone. House perform perhaps.
Soon practice similar even lot available nor. Positive young possible better address billion walk.";Wear material early wish course Democrat consumer.;iwalker;;;;;;;;;;;;;;Open;;;;label2;;label1;"Sign hope four thousand try someone. House perform perhaps.
Soon practice similar even lot available nor. Positive young possible better address billion walk."
Might rule popular interview news.;MFS-93;93;Task;Reopened;MFS;Moon Flight System;software;thomas29;Moon Flight System software project;http://mata-molina.net/;Critical;Won't Fix;thomas29;coxkeith;laura42;2023-09-20 22:30:07;2023-10-18 03:51:08;;;label1;label1;UI;2023-11-16 22:27:30;6;label1;Admit school total his whether film. Yourself show test commercial return yet tell. World small the year.;Everybody expert evening.;thomas29;;;;;;;;;;;;;;Reopened;;;;label4;;label1;Admit school total his whether film. Yourself show test commercial return yet tell. World small the year.
Operation history computer the place thought around.;MFS-94;94;Improvement;In Progress;MFS;Moon Flight System;software;danielstara;Moon Flight System software project;http://www.brown.com/;Medium;Fixed;danielstara;efranklin;bobbyroach;2023-09-27 10:02:41;2023-10-26 02:07:39;;;label2;label2;UI;2023-12-28 00:13:08;3;label4;"Support more forward onto pressure agent cup decision. Speech short think draw statement any sea.
Fly into word land those agree. Commercial million question miss make.";Me during claim back responsibility.;danielstara;;;;;;;;;;;;;;In Progress;;;;label4;;label2;"Support more forward onto pressure agent cup decision. Speech short think draw statement any sea.
Fly into word land those agree. Commercial million question miss make."
Film air key become international American second option.;MFS-95;95;Bug;Closed;MFS;Moon Flight System;software;laura52;Moon Flight System software project;http://www.schaefer-bradford.net/;Critical;Fixed;laura52;veronicasanchez;fraziersierra;2023-09-13 16:47:03;2023-09-09 02:21:53;;2023-09-01 23:36:17;label4;label2;Integration;2023-12-23 10:30:00;4;label2;"Indeed she kid western middle into science strong.
Early these capital view west. Turn administration tough prepare create little suffer.";Mention town clear ago.;laura52;;;;;;;;;;;;;;Closed;;;;label2;;label4;"Indeed she kid western middle into science strong.
Early these capital view west. Turn administration tough prepare create little suffer."
Central officer box conference near.;MFS-96;96;Task;In Progress;MFS;Moon Flight System;software;warrendenise;Moon Flight System software project;http://www.maxwell.com/;Critical;Fixed;warrendenise;alexmcbride;denisekoch;2023-09-11 04:04:53;2023-09-02 13:17:21;;;label2;label1;Core;2023-12-27 02:56:41;2;label2;"Put clearly stay true. Impact trial current between address.
Form tonight approach food. Nice the since ground.";Leader skill experience institution.;warrendenise;;;;;;;;;;;;;;In Progress;;;;label4;;label3;"Put clearly stay true. Impact trial current between address.
Form tonight approach food. Nice the since ground."
Try candidate rich from the have fear effort.;MFS-97;97;Bug;In Progress;MFS;Moon Flight System;software;nicolaslloyd;Moon Flight System software project;https://www.bradley.org/;Low;Duplicate;nicolaslloyd;hessrobert;randy87;2023-09-21 02:23:39;2023-10-25 13:01:20;;;label3;label1;Backend;2023-11-13 04:56:15;8;label2;"Address fear something conference. Word science want against.
Treat maybe student indeed. Far leg season.
Network production close nice real. International three record look.";Brother likely despite government organization.;nicolaslloyd;;;;;;;;;;;;;;In Progress;;;;label2;;label4;"Address fear something conference. Word science want against.
Treat maybe student indeed. Far leg season.
Network production close nice real. International three record look."
Third I near sense bank.;MFS-98;98;New Feature;Closed;MFS;Moon Flight System;software;sandra67;Moon Flight System software project;https://morris-bradford.com/;Critical;Fixed;sandra67;gonzalezcheryl;ashley86;2023-09-28 18:38:56;2023-10-29 00:34:55;;2023-09-26 12:18:20;label3;label4;UI;2023-12-28 20:47:28;4;label4;Maintain animal image drug get. Worker guy listen when answer conference name.;Nor lose management responsibility always.;sandra67;;;;;;;;;;;;;;Closed;;;;label2;;label2;Maintain animal image drug get. Worker guy listen when answer conference name.
Ready weight community response health bit.;MFS-99;99;Task;In Progress;MFS;Moon Flight System;software;abigail54;Moon Flight System software project;https://cabrera.com/;High;Duplicate;abigail54;kevinpatel;kristina24;2023-09-23 07:36:05;2023-10-08 04:42:58;;;label3;label4;Integration;2023-11-05 18:11:30;1;label3;Shake interesting evidence avoid. Computer nearly travel occur itself church.;Receive she also as fine usually.;abigail54;;;;;;;;;;;;;;In Progress;;;;label2;;label3;Shake interesting evidence avoid. Computer nearly travel occur itself church.
Sign well attorney condition evening tend.;MFS-100;100;Bug;In Progress;MFS;Moon Flight System;software;greentara;Moon Flight System software project;https://www.hanson.info/;Low;Fixed;greentara;isexton;jtaylor;2023-09-09 12:01:03;2023-09-07 12:17:03;;;label4;label2;UI;2023-12-09 20:48:28;7;label3;"Write happy national easy leader population care.
Which after majority give despite visit consumer. Out outside skill property.
Enough according hold away success.";Concern around do item.;greentara;;;;;;;;;;;;;;In Progress;;;;label4;;label3;"Write happy national easy leader population care.
Which after majority give despite visit consumer. Out outside skill property.
Enough according hold away success."
